{
  "$schema": "./compatibility-matrix.schema.json",
  "status": "registry-and-runtime-verified",
  "verifiedAt": "2026-08-29T05:17:49.2786420Z",
  "runtime": {
    "solid-js": "1.9.15",
    "@tanstack/solid-start": "1.168.47",
    "@tanstack/solid-router": "1.170.30",
    "@tanstack/solid-query": "5.102.8",
    "@tanstack/solid-table": "9.2.4",
    "@tanstack/table-core": "9.2.4"
  },
  "toolchain": {
    "@cloudflare/vite-plugin": "1.54.1",
    "@tanstack/router-cli": "1.167.33",
    "vite": "8.2.1",
    "vite-plugin-solid": "2.11.14",
    "wrangler": "4.127.1",
    "typescript": "7.0.2",
    "@playwright/test": "1.62.1"
  },
  "limitations": [
    {
      "id": "solid2-rc",
      "severity": "high",
      "summary": "SolidJS 2.0.0-rc.4 removes the solid-js/web export while @tanstack/solid-router 2.0.0-rc.4 declarations still import it. Production stays on the verified Solid 1 line until the public RC packages converge and pass this canary."
    },
    {
      "id": "typescript-programmatic-api",
      "severity": "medium",
      "summary": "TypeScript 7.0.2 is the native project compiler and does not expose the legacy JavaScript programmatic compiler API. No TypeScript 6 alias is currently used."
    }
  ]
}
